{
  "change_id": "fixture-45",
  "phase": "impl",
  "management": "clickup",
  "approvals": {
    "requirements": {
      "generated": true,
      "approved": true
    },
    "architecture": {
      "generated": true,
      "approved": true
    },
    "tasks": {
      "generated": true,
      "approved": true
    }
  },
  "clickup": {
    "epic_id": "abc12",
    "feature_ids": [
      "abc13"
    ],
    "task_ids": {
      "E1.F1.T1": "abc14"
    }
  }
}
