{
  "change_id": "feat-a",
  "phase": "requirements",
  "schema_version": 1,
  "phase_history": [
    {"phase": "init", "entered_at": "2026-09-23T10:00:00-03:00", "exited_at": "2026-09-23T10:00:00-03:00"},
    {"phase": "requirements", "entered_at": "2026-09-23T10:00:00-03:00"}
  ],
  "approvals": {"requirements": {"generated": true, "approved": false}}
}
